id,category,english,korean,grammar_id,grammar_name,structure,difficulty,page
L04-P-01,Reading,"I watched the movie Hidden Figures last weekend. It was a movie about three African-American women who worked at NASA. They began their career in the 1960s as “human computers.” However, they dreamed of becoming space experts at NASA and tried hard to get over difficulties.",나는 지난 주말에 영화 '히든 피겨스'를 보았습니다. 그것은 NASA에서 일한 세 명의 아프리카계 미국인 여성들에 관한 영화였습니다. 그들은 1960년대에 '인간 컴퓨터'로서 경력을 시작했습니다. 하지만 그들은 NASA의 우주 전문가가 되는 것을 꿈꿨고 어려움을 극복하기 위해 열심히 노력했습니다.,G0407,주격 관계대명사,N + who + V,하,67
L04-P-02,Reading,"Katherine Johnson showed a talent in math, and her manager Al Harrison recognized her ability. One day, he got upset when Katherine was missing from her desk for too long. Katherine answered, “There are no COLORED bathrooms in this building. I have to run half a mile away just to use the bathroom.” Hearing this, I felt really sorry for her.","캐서린 존슨은 수학에 재능을 보였고, 그녀의 매니저인 알 해리슨은 그녀의 능력을 알아보았습니다. 어느 날, 캐서린이 책상에서 너무 오랫동안 자리를 비우자 그는 화가 났습니다. 캐서린은 대답했습니다. ""이 건물에는 유색인종 전용 화장실이 없어요. 저는 화장실을 이용하기 위해 반 마일이나 떨어진 곳으로 달려가야만 해요."" 이 말을 듣고 나는 그녀가 정말 안타까웠습니다.",G0409,분사구문 / 접속사 when,Hearing this / when S + V,상,67-68
L04-P-03,Reading,"Mary Jackson was the character I liked the most. She wanted to learn more about rocket science, but she wasn’t allowed to go to a white school. So, she asked a judge to give her permission. The judge was impressed by what she said and finally gave her permission. Mary stood up for herself and for other African-Americans. That was what impressed me most in the movie.","메리 잭슨은 내가 가장 좋아한 캐릭터였습니다. 그녀는 로켓 과학에 대해 더 공부하고 싶어 했지만, 백인 학교에 가는 것이 허용되지 않았습니다. 그래서 그녀는 판사에게 자신에게 허가를 내달라고 부탁했습니다. 판사는 그녀가 한 말에 감명받았고 마침내 그녀에게 허가를 내주었습니다. 메리는 자신과 다른 아프리카계 미국인들을 위해 일어섰습니다. 그것이 영화에서 나를 가장 감동시킨 장면이었습니다.",G0410,관계대명사 what,what she said / what impressed me,상,68
L04-P-04,Reading,"Dorothy Vaughan was the last “hidden figure.” When IBM computers were installed at NASA in 1961, she was worried the “human computers” would lose their jobs. She studied a new programming language, FORTRAN, and taught it to her team members. Later, when she was asked to be the leader of a new IBM team, she made a suggestion: “I’m not accepting the offer if I can’t bring my ladies with me. We need a lot of people to program that machine.”","도로시 본은 마지막 '숨겨진 인물'이었습니다. 1961년 NASA에 IBM 컴퓨터가 설치되었을 때, 그녀는 '인간 컴퓨터'들이 일자리를 잃을까 봐 걱정했습니다. 그녀는 새로운 프로그래밍 언어인 포트란(FORTRAN)을 공부했고, 그것을 팀원들에게 가르쳤습니다. 나중에 그녀가 새로운 IBM 팀의 팀장이 되어 달라는 요청을 받았을 때, 그녀는 제안을 했습니다. ""제 동료들을 데려갈 수 없다면 그 제안을 수락하지 않을 것입니다. 그 기계를 프로그래밍하려면 많은 사람이 필요합니다.""",G0411,동격 표현 / 조건의 접속사,FORTRAN / if I can't bring,중,69
L04-P-05,Reading,"Thanks to Dorothy, her team members could become programmers. She wasn’t afraid of change and used it as a chance. That’s what I need to learn from her. Watching this movie, I could learn how to face challenges in life. I won’t forget the tears and laughter of Katherine, Mary, and Dorothy.","도로시 덕분에 그녀의 팀원들은 프로그래머가 될 수 있었습니다. 그녀는 변화를 두려워하지 않았고 그것을 기회로 이용했습니다. 그것이 내가 그녀로부터 배워야 할 점입니다. 이 영화를 보면서 나는 인생의 도전에 맞서는 법을 배울 수 있었습니다. 나는 캐서린, 메리, 도로시의 눈물과 웃음을 잊지 못할 것입니다.",G0409,분사구문 / 관계대명사 what,Watching / what I need to learn,상,70
